{
  "palette": "({units.temp}==F?({day0.feels}-32)/1.8:{day0.feels})>=24?hot:({units.temp}==F?({day0.feels}-32)/1.8:{day0.feels})>=15?mild:({units.temp}==F?({day0.feels}-32)/1.8:{day0.feels})>=5?cool:cold",
  "palettes": {"hot": {"bg": "#ffb347", "cloth": "#ff5e57", "trim": "#b8322c", "fg": "#3b1d00", "dim": "#7a4300"}, "mild": {"bg": "#a8e6cf", "cloth": "#3d84a8", "trim": "#1f4e66", "fg": "#073b3a", "dim": "#2f6b5f"}, "cool": {"bg": "#3d5a80", "cloth": "#e9c46a", "trim": "#a8832c", "fg": "#ffffff", "dim": "#c9d6ea"}, "cold": {"bg": "#1d2b53", "cloth": "#f4a261", "trim": "#b0652c", "fg": "#ffffff", "dim": "#9fb2d9"}},
  "bg": "@bg",
  "items": [
    {"type": "text", "x": 12, "y": 16, "text": "WEAR TODAY", "font": 2, "align": "ml", "color": "@dim"},
    {"type": "text", "x": 228, "y": 16, "text": "{time.hm}", "font": 2, "align": "mr", "color": "@dim", "bg": "@bg", "pad": 12},
    {"type": "sprite", "x": 120, "y": 88, "align": "mc", "scale": 8, "bg": "@bg", "palette": {"c": "@cloth", "z": "@trim", "d": "@trim", "b": "@trim", "s": "#f1c27d", "w": "#ffffff"}, "frame": "({units.temp}==F?({day0.feels}-32)/1.8:{day0.feels})>=24?0:({units.temp}==F?({day0.feels}-32)/1.8:{day0.feels})>=15?1:({units.temp}==F?({day0.feels}-32)/1.8:{day0.feels})>=5?2:3", "frames": [["...cc..cc...", ".cccc..cccc.", "cccccccccccc", "cccccccccccc", "cc.cccccc.cc", "...cccccc...", "...cccccc...", "...cccccc...", "...cccccc...", "...cccccc...", "............", "............"], ["..ccc..ccc..", ".cccczzcccc.", "ccccczzccccc", "ccccczzccccc", "cc.cczzcc.cc", "cc.cczzcc.cc", "cc.cczzcc.cc", "cc.cczzcc.cc", "ss.cczzcc.ss", "...cczzcc...", "............", "............"], ["..ddd..ddd..", ".cccc..cccc.", "cccccbbccccc", "cccccccccccc", "cc.ccbbcc.cc", "cc.cccccc.cc", "cc.dddddd.cc", "cc.ccbbcc.cc", "ss.cccccc.ss", "...cccccc...", "...cccccc...", "...cccccc..."], ["..wwwwwwww..", ".wccccccccw.", ".wc......cw.", ".wccccccccw.", "cccccccccccc", "cdccccccccdc", "cccccccccccc", "cdccccccccdc", "cc.cccccc.cc", "ss.cccccc.ss", "...cccccc...", "...cccccc..."]]},
    {"type": "text", "x": 120, "y": 158, "text": "{({units.temp}==F?({day0.feels}-32)/1.8:{day0.feels})>=24?T shirt weather:({units.temp}==F?({day0.feels}-32)/1.8:{day0.feels})>=15?Light jacket:({units.temp}==F?({day0.feels}-32)/1.8:{day0.feels})>=5?Warm coat:Bundle up}", "font": 4, "align": "mc", "color": "@fg", "bg": "@bg", "pad": 30},
    {"type": "sprite", "x": 72, "y": 192, "align": "mc", "scale": 4, "palette": {"u": "#ff5d8f", "h": "#4a4a4a"}, "rows": ["..uuuu..", ".uuuuuu.", "uuuuuuuu", "...h", "...h", "...h", ".h.h", "..h"], "show": "{day0.rain}>=50"},
    {"type": "sprite", "x": 120, "y": 192, "align": "mc", "scale": 4, "palette": {"k": "#1d1d1d"}, "rows": ["kkkkkkkk", "kkk..kkk", ".k....k."], "show": "{now.code}<=1&&{sun.up}&&({units.temp}==F?({day0.feels}-32)/1.8:{day0.feels})>=15"},
    {"type": "sprite", "x": 168, "y": 192, "align": "mc", "scale": 4, "palette": {"r": "#e63946", "w": "#ffffff"}, "rows": ["rrrrrrrr", "wwwwwwww", "rrrrrrrr", ".....rw", ".....wr", ".....rw", ".....wr"], "show": "({units.temp}==F?({day0.feels}-32)/1.8:{day0.feels})<5"},
    {"type": "text", "x": 120, "y": 222, "text": "Feels {day0.feels}  Low {day0.low}  Rain {day0.rain}%", "font": 2, "align": "mc", "color": "@dim", "bg": "@bg", "pad": 10}
  ]
}
