{
  "bg": "#262624",
  "fps": 4,
  "maps": {"say": {"thinking": "Thinking", "working": "Writing code", "done": "All done!", "fail": "Needs a look", "*": "Ready when you are"}, "tone": {"thinking": "#8ab4f8", "working": "#f2c94c", "done": "#7fd18b", "fail": "#ff6b5e", "*": "#d97757"}},
  "items": [
    {"type": "text", "x": 12, "y": 16, "text": "Claude Code", "font": 2, "align": "ml", "color": "#d97757"},
    {"type": "text", "x": 228, "y": 16, "text": "{time.hm}", "font": 2, "align": "mr", "color": "#a8a59b", "bg": "#262624", "pad": 12},
    {"type": "circle", "x": 214, "y": 46, "r": 12, "color": "#d97757", "show": "{msg.count}>0"},
    {"type": "text", "x": 214, "y": 46, "text": "{msg.count}", "font": 2, "align": "mc", "color": "#262624", "show": "{msg.count}>0"},
    {"type": "sprite", "x": 120, "y": 112, "align": "mc", "scale": 10, "bg": "#262624", "palette": {"o": "#d97757", "k": "#1f1e1d", "r": "#ff6b5e"}, "frame": "{state|idle}==done?2+{time.sec}%2:{state|idle}==working?4+({time.ms}>=500):{state|idle}==fail?6:{state|idle}==thinking?8:{sun.up}==0?7:{time.sec}%6==0?1:0", "frames": [["", "..oooooooooo", "..oooooooooo", "..ookooookoo", "..ookooookoo", "oooooooooooooo", "oooooooooooooo", "..oooooooooo", "..o.o....o.o", "..o.o....o.o"], ["", "..oooooooooo", "..oooooooooo", "..oooooooooo", "..ookooookoo", "oooooooooooooo", "oooooooooooooo", "..oooooooooo", "..o.o....o.o", "..o.o....o.o"], ["", "o.oooooooooo.o", "oooooooooooooo", "..oooooooooo", "..ookooookoo", "..oooooooooo", "..oooooooooo", "..oooooooooo", "..o.o....o.o", "..o.o....o.o"], ["o.oooooooooo.o", "oooooooooooooo", "..oooooooooo", "..ookooookoo", "..oooooooooo", "..oooooooooo", "..oooooooooo", "..o.o....o.o", "..o.o....o.o", ""], ["", "..oooooooooo", "..oooooooooo", "..oooooooooo", "..ookooookoo", "oooooooooooo", "..oooooooooooo", "..oooooooooo", "..o.o....o.o", "..o.o....o.o"], ["", "..oooooooooo", "..oooooooooo", "..oooooooooo", "..ookooookoo", "..oooooooooooo", "oooooooooooo", "..oooooooooo", "..o.o....o.o", "..o.o....o.o"], ["", "..oooooooooo", "..oooooooooo", "..oorooooroo", "..oorooooroo", "..oooooooooo", "..oooooooooo", "oooooooooooooo", "..o.o....o.o", "..o.o....o.o"], ["", "", "..oooooooooo", "..oooooooooo", "..okkoookkoo", "..oooooooooo", "..oooooooooo", "oooooooooooooo", "..oooooooooo", "..o.o....o.o"], ["", "..oooooooooo", "..ookooookoo", "..ookooookoo", "..oooooooooo", "oooooooooooooo", "oooooooooooooo", "..oooooooooo", "..o.o....o.o", "..o.o....o.o"]]},
    {"type": "sprite", "x": 196, "y": 70, "align": "mc", "scale": 6, "bg": "#262624", "palette": {"w": "#f5f4ee", "d": "#5c5a55"}, "frame": "{time.sec}%3", "frames": [["w.d.d"], ["d.w.d"], ["d.d.w"]], "show": "{state|idle}==thinking"},
    {"type": "text", "x": 164, "y": 74, "text": "z", "font": 2, "color": "#8ab4f8", "show": "{sun.up}==0&&{state|idle}==idle"},
    {"type": "text", "x": 178, "y": 48, "text": "Z", "font": 4, "color": "#8ab4f8", "show": "{sun.up}==0&&{state|idle}==idle"},
    {"type": "text", "x": 120, "y": 186, "text": "{state:say}", "font": 4, "align": "mc", "color": "{state:tone}", "bg": "#262624", "pad": 30, "show": "!({sun.up}==0&&{state|idle}==idle)"},
    {"type": "text", "x": 120, "y": 186, "text": "Sleeping until {sun.rise}", "font": 2, "align": "mc", "color": "#8ab4f8", "show": "{sun.up}==0&&{state|idle}==idle"},
    {"type": "text", "x": 120, "y": 216, "text": "{task:28|No task yet}", "font": 2, "align": "mc", "color": "#a8a59b", "bg": "#262624", "pad": 20}
  ]
}
